<?xml version="1.0" encoding="utf-8"?>
<discs xmlns="mediateka" xmlns:xsi="http://www.w3.org/2001/XMLSchema-instance"
 xsi:schemaLocation="mediateka discs.xsd" autoIndex="3">
   <disc discID="1">
		<ownerID>1</ownerID>
		<format>DVD</format>
		<regionCode>3</regionCode>
        <isPresent>false</isPresent>
	</disc>
	<disc discID="2">
	<ownerID>1</ownerID>
		<format>Blu-ray</format>
		<regionCode>2</regionCode>
		<isPresent>true</isPresent>
	</disc>
</discs>





